{
  "schema_version": "lineup-analysis-output-v2",
  "team_profiles": {
    "blue_team": {
      "archetype_tags": ["强开团", "后排突进", "小规模作战"],
      "composition_summary": "蓝方依靠多段进场制造集中控制，再由近身输出核心跟进，主动发起能力强，但阵型一旦脱节就很难持续保护后排。",
      "strengths": [
        "多名英雄能够衔接先手，集中目标时爆发窗口明确",
        "在狭窄区域更容易让范围控制与后续伤害同时覆盖"
      ],
      "weaknesses": [
        "整体作战距离偏短，进场技能被化解后容易遭到拉扯",
        "前后排同时前压时，持续输出位可能缺少稳定保护"
      ]
    },
    "red_team": {
      "archetype_tags": ["反开保护", "前后排正面团", "保核"],
      "composition_summary": "红方以稳定前排、反突进工具和后排持续输出形成前后排体系，更擅长接住对方第一轮进场后持续反打。",
      "strengths": [
        "前排和保护工具较完整，能够为后排创造持续输出空间",
        "清线与阵地控制有利于拖延并提前占据资源区域"
      ],
      "weaknesses": [
        "后排输出承担较高，核心被多方向同时接近时阵容强度明显下降",
        "主动追击与远距离留人能力有限，容易错过已经拉开的目标"
      ]
    }
  },
  "decisive_interactions": [
    {
      "interaction_type": "队内协同",
      "actors": ["熔岩巨兽", "疾风剑豪"],
      "mechanism": "蓝方先手击飞可以为后续进场提供明确触发窗口",
      "condition": "先手必须命中关键目标，且跟进者处于可安全接续的位置",
      "impact": "一旦控制与跟进同时覆盖红方后排，蓝方可以迅速打破前后排阵型；若先手只命中前排，后续进场价值会明显下降。"
    },
    {
      "interaction_type": "跨阵营克制",
      "actors": ["圣锤之毅", "蓝方突进英雄"],
      "mechanism": "红方的反突进工具能够限制部分依赖位移接近后排的方式",
      "condition": "反突进技能需要被保留，并且防守者与己方后排没有脱节",
      "impact": "蓝方不能只依赖单一方向同时进场，需要先逼出关键防守技能或从不同角度制造压力。"
    },
    {
      "interaction_type": "跨阵营克制",
      "actors": ["红方前排与保护体系", "蓝方短手输出核心"],
      "mechanism": "红方可以用前排阻隔和连续控制延长蓝方接近后排的时间",
      "condition": "红方保持完整阵型，并避免在视野缺失时被蓝方提前绕后",
      "impact": "正面列阵越完整，红方持续输出越容易发挥；阵型被侧翼切开时，这一结构优势会快速下降。"
    }
  ],
  "comparative_outlook": {
    "power_curve": {
      "blue_team": {
        "strong_stage_tags": ["中期"],
        "explanation": "关键团战技能齐备后，蓝方能够通过集中先手快速制造人数差，但需要在红方后排体系完全成型前主动创造机会。"
      },
      "red_team": {
        "strong_stage_tags": ["中期", "后期"],
        "explanation": "随着前排和持续输出结构逐渐完整，红方正面接团的容错与持续作战能力会提高。"
      },
      "comparison": "蓝方更依赖中期主动开团兑现控制链，红方则更愿意延长对局并保持完整阵型接战。"
    },
    "teamfight_structure": "蓝方需要用先手和侧翼迅速压缩红方后排空间；红方需要让前排承接第一轮技能，并用反突进和保护工具维持前后排距离。",
    "fight_conditions": {
      "blue_team": {
        "preferred_condition_tags": ["侧翼夹击", "狭窄资源区", "提前占据视野"],
        "unfavorable_condition_tags": ["开阔地形", "消耗拉扯"],
        "explanation": "蓝方在视野领先和入口集中的环境中更容易完成范围先手，但在开阔区域持续追击时容易被红方逐步拉开。"
      },
      "red_team": {
        "preferred_condition_tags": ["正面五人团", "反手接团", "推进或守塔"],
        "unfavorable_condition_tags": ["侧翼夹击", "迫使对方探视野"],
        "explanation": "红方需要看见蓝方主要进场方向并保持保护阵型；被迫进入无视野区域或同时应对多个方向时，后排更容易暴露。"
      }
    },
    "map_and_resource_implications": "蓝方应争取先进入资源区并控制侧翼入口，红方则应依靠清线和视野逐步推进，避免在没有确认蓝方位置时直接进入狭窄通道。"
  },
  "win_conditions": {
    "blue_team": [
      {
        "goal": "在中期资源团中打破红方前后排阵型",
        "execution": "提前控制侧翼视野，先逼迫或绕开红方反突进工具，再让多段进场集中覆盖后排核心。",
        "key_condition": "先手、跟进和后续输出必须处于可衔接距离",
        "failure_risk": "第一轮技能只命中前排或多人同时被反突进打断"
      }
    ],
    "red_team": [
      {
        "goal": "保持完整阵型接住蓝方第一轮进场并持续反打",
        "execution": "前排负责阻隔正面入口，关键保护技能留给蓝方突进窗口，后排优先维持安全输出距离。",
        "key_condition": "防守者与后排保持联系，并提前发现蓝方侧翼位置",
        "failure_risk": "在视野缺失时被多方向夹击，导致保护工具无法覆盖同一目标"
      }
    ]
  },
  "risks_and_uncertainties": [
    "该分析只基于静态阵容与位置，不包含实时经济、装备、召唤师技能和选手执行差异。"
  ]
}
